{
  "id": "workflow.comic_panel_full",
  "name": "Comic Panel Full Workflow",
  "name_zh": "漫画分镜完整流程",
  "description": "Generate a complete comic panel with character, scene, composition, and lighting.",
  "description_zh": "生成完整的漫画分镜：角色 + 场景 + 构图 + 灯光",
  "use_case": ["comic", "storyboard"],
  "api_targets": ["SDXL", "Midjourney", "Flux"],
  "output_format": "comma_separated",
  "steps": [
    {
      "order": 1,
      "template_id": "character.reference_description",
      "required": true,
      "description_zh": "角色锚点"
    },
    {
      "order": 2,
      "template_id": "scene.environment",
      "required": true,
      "description_zh": "场景环境"
    },
    {
      "order": 3,
      "template_id": "panel.composition",
      "required": true,
      "description_zh": "构图与景别"
    },
    {
      "order": 4,
      "template_id": "lighting.mood",
      "required": true,
      "description_zh": "灯光氛围"
    },
    {
      "order": 5,
      "template_id": "quality.standard",
      "required": false,
      "description_zh": "质量提升词"
    }
  ],
  "example_output": "girl 16 years old white long hair blue eyes fair skin, school rooftop at sunset, medium shot, cinematic lighting, masterpiece, best quality",
  "created_at": "2026-10-11",
  "version": "1.0.0"
}
